<?xml version="1.0" encoding="utf-8" ?>
<Datatable xmlns:xsi="http://www.w3.org/2001/XMLSchema-instance" xmlns:xsd="http://www.w3.org/2001/XMLSchema" xsi:noNamespaceSchemaLocation="../Schemas/TechnologyLinkDefinition.xsd">
	<!-- Common -->
	<TechnologyLinkDefinition Name="TechnologyLinkDefinitionScienceAndExploration2To4CommonWormholeUnique" Category="TechnologyLinkTypeCostReduction" PrerequisiteResolution="OR">
		<TechnologyPrerequisite Flags="TechnologyLinkAvailability">TechnologyColonization2Common</TechnologyPrerequisite>
		<TechnologyPrerequisite Flags="TechnologyLinkAvailability">TechnologyWormholeCommonUnique</TechnologyPrerequisite>
		<SimulationDescriptorReference Name="TechnologyLinkScienceAndExploration2To4"/>
	</TechnologyLinkDefinition>

	<TechnologyLinkDefinition Name="TechnologyLinkDefinitionScienceAndExploration2To4" Category="TechnologyLinkTypeCostReduction" PrerequisiteResolution="OR">
		<TechnologyPrerequisite Flags="TechnologyLinkAvailability">TechnologyColonization2Common</TechnologyPrerequisite>
		<TechnologyPrerequisite Flags="TechnologyLinkAvailability">TechnologyWormholeCommon</TechnologyPrerequisite>
		<SimulationDescriptorReference Name="TechnologyLinkScienceAndExploration2To4"/>
	</TechnologyLinkDefinition>

	<!-- Unfallen -->
	<TechnologyLinkDefinition Name="TechnologyLinkDefinitionScienceAndExploration2To4UnfallenWormholeUnique" Category="TechnologyLinkTypeCostReduction" PrerequisiteResolution="OR">
		<TechnologyPrerequisite Flags="TechnologyLinkAvailability">TechnologyColonization2Unfallen</TechnologyPrerequisite>
		<TechnologyPrerequisite Flags="TechnologyLinkAvailability">TechnologyWormholeUnfallenCommonUnique</TechnologyPrerequisite>
		<SimulationDescriptorReference Name="TechnologyLinkScienceAndExploration2To4"/>
	</TechnologyLinkDefinition>

	<TechnologyLinkDefinition Name="TechnologyLinkDefinitionScienceAndExploration2To4Unfallen" Category="TechnologyLinkTypeCostReduction" PrerequisiteResolution="OR">
		<TechnologyPrerequisite Flags="TechnologyLinkAvailability">TechnologyColonization2Unfallen</TechnologyPrerequisite>
		<TechnologyPrerequisite Flags="TechnologyLinkAvailability">TechnologyWormholeUnfallenCommon</TechnologyPrerequisite>
		<SimulationDescriptorReference Name="TechnologyLinkScienceAndExploration2To4"/>
	</TechnologyLinkDefinition>

	<!-- Riftborn -->
	<TechnologyLinkDefinition Name="TechnologyLinkDefinitionScienceAndExploration2To4TimeLordsWormholeUnique" Category="TechnologyLinkTypeCostReduction" PrerequisiteResolution="OR">
		<TechnologyPrerequisite Flags="TechnologyLinkAvailability">TechnologyColonization2TimeLords</TechnologyPrerequisite>
		<TechnologyPrerequisite Flags="TechnologyLinkAvailability">TechnologyWormholeTimeLordsCommonUnique</TechnologyPrerequisite>
		<SimulationDescriptorReference Name="TechnologyLinkScienceAndExploration2To4"/>
	</TechnologyLinkDefinition>

	<TechnologyLinkDefinition Name="TechnologyLinkDefinitionScienceAndExploration2To4TimeLords" Category="TechnologyLinkTypeCostReduction" PrerequisiteResolution="OR">
		<TechnologyPrerequisite Flags="TechnologyLinkAvailability">TechnologyColonization2TimeLords</TechnologyPrerequisite>
		<TechnologyPrerequisite Flags="TechnologyLinkAvailability">TechnologyWormholeTimeLordsCommon</TechnologyPrerequisite>
		<SimulationDescriptorReference Name="TechnologyLinkScienceAndExploration2To4"/>
	</TechnologyLinkDefinition>
	
	<!-- Vaulters (Movement) -->
	<TechnologyLinkDefinition Name="TechnologyLinkDefinitionScienceAndExploration2To4VaultersWormholeUnique" Category="TechnologyLinkTypeCostReduction" PrerequisiteResolution="OR">
		<TechnologyPrerequisite Flags="TechnologyLinkAvailability">TechnologyLinkTo2Vaulters</TechnologyPrerequisite>
		<TechnologyPrerequisite Flags="TechnologyLinkAvailability">TechnologyWormholeVaultersCommonUnique</TechnologyPrerequisite>
		<SimulationDescriptorReference Name="TechnologyLinkScienceAndExploration2To4"/>
	</TechnologyLinkDefinition>
	<TechnologyLinkDefinition Name="TechnologyLinkDefinitionScienceAndExploration2To4Vaulters" Category="TechnologyLinkTypeCostReduction" PrerequisiteResolution="OR">
		<TechnologyPrerequisite Flags="TechnologyLinkAvailability">TechnologyLinkTo2Vaulters</TechnologyPrerequisite>
		<TechnologyPrerequisite Flags="TechnologyLinkAvailability">TechnologyWormholeVaultersCommon</TechnologyPrerequisite>
		<SimulationDescriptorReference Name="TechnologyLinkScienceAndExploration2To4"/>
	</TechnologyLinkDefinition>

	<!-- Trade -->
	<TechnologyLinkDefinition Name="TechnologyLinkDefinitionEconomyAndTrade5To9" Category="TechnologyLinkTypeCostReduction" PrerequisiteResolution="OR">
		<TechnologyPrerequisite Flags="TechnologyLinkAvailability">TechnologyDust1Alt</TechnologyPrerequisite>
		<TechnologyPrerequisite Flags="TechnologyLinkAvailability">TechnologyTrade1</TechnologyPrerequisite>
		<SimulationDescriptorReference Name="TechnologyLinkEconomyAndTrade5To9" />
	</TechnologyLinkDefinition>
	<TechnologyLinkDefinition Name="TechnologyLinkDefinitionEconomyAndTrade5To9Vampirillis" Category="TechnologyLinkTypeCostReduction" PrerequisiteResolution="OR">
		<TechnologyPrerequisite Flags="TechnologyLinkAvailability">TechnologyDust1Vampirilis</TechnologyPrerequisite>
		<TechnologyPrerequisite Flags="TechnologyLinkAvailability">TechnologyTrade1</TechnologyPrerequisite>
		<SimulationDescriptorReference Name="TechnologyLinkEconomyAndTrade5To9" />
	</TechnologyLinkDefinition>
  
  <!-- Citadel Extensions -->
  <TechnologyLinkDefinition Name="TechnologyLinkDefinitionDependencyEmpireDevelopmentJuggernaut3To5" Category="TechnologyLinkTypeDependency" PrerequisiteResolution="OR">
    <TechnologyPrerequisite Flags="TechnologyLinkAvailability">TechnologyLinkToEmpireDevelopmentJuggernaut3</TechnologyPrerequisite>
    <SimulationDescriptorReference Name="TechnologyLinkDefinitionDependencyEmpireDevelopmentJuggernaut3To5"/>
  </TechnologyLinkDefinition>

  <!-- Hulls -->
  <!-- Efficient Shielding to Extreme Composites -->
  <TechnologyLinkDefinition Name="TechnologyLinkDefinitionEmpireDevelopmentUnique1ToUnique2" Category="TechnologyLinkTypeCostReduction" PrerequisiteResolution="OR">
	<TechnologyPrerequisite Flags="TechnologyLinkAvailability">TechnologyUnique1Link</TechnologyPrerequisite>
	<TechnologyPrerequisite Flags="TechnologyLinkAvailability">TechnologyUnique2Link</TechnologyPrerequisite>
	<SimulationDescriptorReference Name="TechnologyLinkEmpireDevelopmentUnique1ToUnique2"/>
  </TechnologyLinkDefinition>

  <!-- Efficient Shielding to Agri Drugs -->
  <TechnologyLinkDefinition Name="TechnologyLinkDefinitionEmpireDevelopmentUnique1ToUnique3" Category="TechnologyLinkTypeCostReduction" PrerequisiteResolution="OR">
	<TechnologyPrerequisite Flags="TechnologyLinkAvailability">TechnologyUnique1Link</TechnologyPrerequisite>
	<TechnologyPrerequisite Flags="TechnologyLinkAvailability">TechnologyUnique3Link</TechnologyPrerequisite>
	<SimulationDescriptorReference Name="TechnologyLinkEmpireDevelopmentUnique1ToUnique3"/>
  </TechnologyLinkDefinition>
  
  <!-- Split-Second Ablatives to Dependency Algorithms -->
  <TechnologyLinkDefinition Name="TechnologyLinkDefinitionEmpireDevelopmentUnique5ToUnique6" Category="TechnologyLinkTypeCostReduction" PrerequisiteResolution="OR">
	<TechnologyPrerequisite Flags="TechnologyLinkAvailability">TechnologyUnique5Link</TechnologyPrerequisite>
	<TechnologyPrerequisite Flags="TechnologyLinkAvailability">TechnologyUnique6Link</TechnologyPrerequisite>
	<SimulationDescriptorReference Name="TechnologyLinkEmpireDevelopmentUnique5ToUnique6"/>
  </TechnologyLinkDefinition>
  
  <!-- Split-Second Ablatives to Low Temperature Construction -->
  <TechnologyLinkDefinition Name="TechnologyLinkDefinitionEmpireDevelopmentUnique5ToUnique7" Category="TechnologyLinkTypeCostReduction" PrerequisiteResolution="OR">
	<TechnologyPrerequisite Flags="TechnologyLinkAvailability">TechnologyUnique5Link</TechnologyPrerequisite>
	<TechnologyPrerequisite Flags="TechnologyLinkAvailability">TechnologyUnique7Link</TechnologyPrerequisite>
	<SimulationDescriptorReference Name="TechnologyLinkEmpireDevelopmentUnique5ToUnique7"/>
  </TechnologyLinkDefinition>

  <!-- Liquid Composites to Far Halo Shipyards -->
  <TechnologyLinkDefinition Name="TechnologyLinkDefinitionEmpireDevelopmentUnique8ToUnique9" Category="TechnologyLinkTypeCostReduction" PrerequisiteResolution="OR">
	<TechnologyPrerequisite Flags="TechnologyLinkAvailability">TechnologyUnique8Link</TechnologyPrerequisite>
	<TechnologyPrerequisite Flags="TechnologyLinkAvailability">TechnologyUnique9Link</TechnologyPrerequisite>
	<SimulationDescriptorReference Name="TechnologyLinkEmpireDevelopmentUnique8ToUnique9"/>
  </TechnologyLinkDefinition>
  
  <!-- Citadel Blueprints to Citadel Basic Upgrade -->
  <TechnologyLinkDefinition Name="TechnologyLinkDefinitionEmpireDevelopmentJuggernaut2To3" Category="TechnologyLinkTypeDependency" PrerequisiteResolution="OR">
	<TechnologyPrerequisite Flags="TechnologyLinkAvailability">TechnologyLinkToEmpireDevelopmentJuggernaut2</TechnologyPrerequisite>
	<SimulationDescriptorReference Name="TechnologyLinkEmpireDevelopmentJuggernaut2To3" />
  </TechnologyLinkDefinition>
</Datatable>